<?xml version="1.0" encoding="UTF-8"?>
<release xmlns="http://www.iodalliance.com/schema/ioda_standard_export_v1.16.xsd" xmlns:xsi="http://www.w3.org/2001/XMLSchema-instance" xsi:schemaLocation="http://www.iodalliance.com/schema/ioda_standard_export_v1.16.xsd http://www.iodalliance.com/schema/ioda_standard_export_v1.16.xsd">
  <export_id>9999</export_id>
  <export_date>2007-03-21T11:33:07</export_date>
  <schema_version>1.16</schema_version>
  <partner_code>IODA</partner_code>
  <ioda_release_id>900099</ioda_release_id>
  <release_name>Rhythms</release_name>
  <display_artist_name>Dexter Rhythm</display_artist_name>
  <label>
    <ioda_label_id>9999</ioda_label_id>
    <label_name>Radnor</label_name>
    <city>Atlanta</city>
    <state>GA</state>
    <country>US</country>
    <primary_style>
      <ioda_style_name>Hip-Hop</ioda_style_name>
      <ioda_style_id>999</ioda_style_id>
    </primary_style>
  </label>
  <parental_advisory>false</parental_advisory>
  <c_line>2007 Radnor</c_line>
  <original_release_date>2007-09-09</original_release_date>
  <street_date>2007-09-09</street_date>
  <publish_date>2005-13-19</publish_date>
  <upc_ean>999999999729</upc_ean>
  <release_format>EP</release_format>
  <catalog_type>Cat</catalog_type>
  <primary_style>
		<ioda_style_name>Hip-Hop</ioda_style_name>
    <ioda_style_id>999</ioda_style_id>
  </primary_style>
  <territories>
    <territory>WW</territory>
  </territories>
  <primary_artist>
    <ioda_artist_id>31</ioda_artist_id>
    <artist_name>Dexter Rhythm</artist_name>
    <country>US</country>
  </primary_artist>
  <track>
    <ioda_track_id>9999521</ioda_track_id>
    <track_name>Agony Haggz</track_name>
    <track_length>PT6M7S</track_length>
    <preview_start_time>PT0M30S</preview_start_time>
    <isrc>ZA99T0010399</isrc>
    <primary_artist>
      <ioda_artist_id>33</ioda_artist_id>
      <artist_name>Dexter Rhythm</artist_name>
    </primary_artist>
    <display_artist_name>Dexter Rhythm</display_artist_name>
    <disc_number>1</disc_number>
    <sequence>1</sequence>
    <p_line>2007 Radnoer</p_line>
    <publishing_control>false</publishing_control>
    <for_album_sale>true</for_album_sale>
    <for_track_sale>true</for_track_sale>
    <emphasis>false</emphasis>
    <promo>false</promo>
    <media_file>
      <bitrate>192</bitrate>
      <format>mp3</format>
      <md5_checksum>abd9988751471da73ec186e7a5a95d0d</md5_checksum>
      <file_name>900099-01-001.mp3</file_name>
    </media_file>
  </track>
  <track>
    <ioda_track_id>9999522</ioda_track_id>
    <track_name>Imagery</track_name>
    <track_length>PT11M6S</track_length>
    <preview_start_time>PT0M30S</preview_start_time>
    <isrc>ZA99T0010400</isrc>
    <primary_artist>
      <ioda_artist_id>35</ioda_artist_id>
      <artist_name>Dexter Rhythm</artist_name>
    </primary_artist>
    <display_artist_name>Dexter Rhythm</display_artist_name>
    <disc_number>1</disc_number>
    <sequence>2</sequence>
    <p_line>2007 Radnor</p_line>
    <publishing_control>false</publishing_control>
    <for_album_sale>true</for_album_sale>
    <for_track_sale>true</for_track_sale>
    <emphasis>false</emphasis>
    <promo>false</promo>
    <media_file>
      <bitrate>192</bitrate>
      <format>mp3</format>
      <md5_checksum>57dd9db39948a456ca7382c14158113e</md5_checksum>
      <file_name>999958-01-002.mp3</file_name>
    </media_file>
  </track>
  <track>
    <ioda_track_id>9999523</ioda_track_id>
    <track_name>Heavy 8</track_name>
    <track_length>PT2M55S</track_length>
    <preview_start_time>PT0M30S</preview_start_time>
    <isrc>ZA99T0010401</isrc>
    <primary_artist>
      <ioda_artist_id>35</ioda_artist_id>
      <artist_name>Dexter Rhythm</artist_name>
    </primary_artist>
    <display_artist_name>Dexter Rhythm</display_artist_name>
    <disc_number>1</disc_number>
    <sequence>3</sequence>
    <p_line>2007 Radnor</p_line>
    <publishing_control>false</publishing_control>
    <for_album_sale>true</for_album_sale>
    <for_track_sale>true</for_track_sale>
    <emphasis>false</emphasis>
    <promo>false</promo>
    <media_file>
      <bitrate>192</bitrate>
      <format>mp3</format>
      <md5_checksum>6199992ca6b0b895d11aaf7c606172c0</md5_checksum>
      <file_name>999958-01-003.mp3</file_name>
    </media_file>
  </track>
  <track>
    <ioda_track_id>9999524</ioda_track_id>
    <track_name>The Legend of the Golden Mic</track_name>
    <track_length>PT16M52S</track_length>
    <preview_start_time>PT0M30S</preview_start_time>
    <isrc>ZA99T0010402</isrc>
    <primary_artist>
      <ioda_artist_id>35</ioda_artist_id>
      <artist_name>Dexter Rhythm</artist_name>
    </primary_artist>
    <display_artist_name>Dexter Rhythm</display_artist_name>
    <disc_number>1</disc_number>
    <sequence>4</sequence>
    <p_line>2007 Radnor</p_line>
    <publishing_control>false</publishing_control>
    <for_album_sale>true</for_album_sale>
    <for_track_sale>true</for_track_sale>
    <emphasis>false</emphasis>
    <promo>false</promo>
    <media_file>
      <bitrate>192</bitrate>
      <format>mp3</format>
      <md5_checksum>49efd9bf6abe28045c1709bf6e99c445</md5_checksum>
      <file_name>999958-01-004.mp3</file_name>
    </media_file>
  </track>
  <image>
    <format>jpg</format>
    <width>350</width>
    <height>350</height>
    <x_resolution>72</x_resolution>
    <y_resolution>72</y_resolution>
    <md5_checksum>07bed510ea47c7445c5445aa9b9a68fc</md5_checksum>
    <file_name>999958.jpg</file_name>
  </image>
</release>
